{
  "schema": "skiller-state.v1",
  "sources": [],
  "skills": [],
  "installs": [],
  "extras": [],
  "conflicts": [
    {
      "id": "ledger-conflict-001",
      "target_kind": "shared",
      "target_id": "agents",
      "effective_name": "talking-stick",
      "existing_canonical_id": "other:talking-stick",
      "desired_canonical_id": "mostlydev:talking-stick",
      "status": "foreign-target",
      "safe_choices": [
        "block",
        "skip",
        "adopt-existing"
      ]
    }
  ]
}
